{
  "schema_version": "0.1.0",
  "scenario": "cancellation",
  "sanitization_state": "sanitized",
  "started_at": "2026-07-30T02:29:40.947122+00:00",
  "duration_ms": 5014,
  "upstream_revisions": {
    "qwenpaw": "ebb5b24d0b2559af51d71a38547d88d384357a64",
    "vyane_rs": "319b9da521e3242b482dff46cf92f676b5f38686",
    "rmcp": "3.0.1",
    "python_mcp": "1.29.0"
  },
  "result": "passed",
  "metrics": {
    "cancellation_probe_completed": 1,
    "cancellation_propagated": 0
  },
  "limitations": [
    "pinned QwenPaw coroutine cancellation does not propagate an MCP cancellation notification"
  ]
}
