{
  "schema_version": "0.1.0",
  "scenario": "broadcast",
  "sanitization_state": "sanitized",
  "started_at": "2026-07-30T02:29:45.961975+00:00",
  "duration_ms": 256,
  "upstream_revisions": {
    "qwenpaw": "ebb5b24d0b2559af51d71a38547d88d384357a64",
    "vyane_rs": "319b9da521e3242b482dff46cf92f676b5f38686",
    "rmcp": "3.0.1",
    "python_mcp": "1.29.0"
  },
  "result": "passed",
  "metrics": {
    "independent_valid_responses": 2,
    "max_observed_concurrency": 2,
    "operator_interventions": 0
  },
  "limitations": [
    "synthetic responses, not semantic model review",
    "cost proxy omitted because no paid model was called"
  ]
}
