{
  "schema_version": "0.1.0",
  "scenario": "timeout",
  "sanitization_state": "sanitized",
  "started_at": "2026-07-30T02:29:39.939123+00:00",
  "duration_ms": 1007,
  "upstream_revisions": {
    "qwenpaw": "ebb5b24d0b2559af51d71a38547d88d384357a64",
    "vyane_rs": "319b9da521e3242b482dff46cf92f676b5f38686",
    "rmcp": "3.0.1",
    "python_mcp": "1.29.0"
  },
  "result": "passed",
  "metrics": {
    "timeout_recorded": 1,
    "timeout_duration_ms": 1006,
    "timeout_bound_ms": 2500
  },
  "limitations": [
    "synthetic five-second endpoint with one-second timeout"
  ]
}
